{
  "schema_version": "minimax-h3-a6000-benchmark-record-v1",
  "contract_version": "1.0.0",
  "record_id": "historical-sol-attn-r8-formal-n10-v1",
  "record_status": "accepted_historical",
  "lane_id": "native-short-1344x768-124f-24fps-v1",
  "workload_fingerprint": "e5c613e9f6bfa57daea3a7c34fab9ebe23653fed39e7226655e71aa15645d885",
  "source_evidence": [
    {"path": "technical_report/evidence/minimax_h3_desktop/sol_engine_port/sol_attn_h3_formal_n10_r8_n10_20260812T031757Z/formal_n10_decision.json", "scope": "Formal same-GPU matched 5-step opt-in decision, 10/10 pairs."},
    {"path": "technical_report/evidence/minimax_h3_desktop/sol_engine_port/sol_attn_h3_formal_n10_r8_n10_20260812T031757Z/formal_n10_summary.json", "scope": "Bounded formal claim and resource/quality-proxy summary."}
  ],
  "workload": {
    "task": "t2va", "partition": "FL2VA", "width": 1344, "height": 768, "fps": 24,
    "final_frame_count": 124, "nominal_duration_seconds": 5.166666666666667,
    "audio_sample_rate_hz": 32000, "audio_channels": 2, "num_inference_steps": 5,
    "prompt": {"id": "t2va-example-1", "sha256": "98f36b879692095e099ae824c18d9e93e7006a490e082fd474a5f531769dcf06", "source": "NVLabs/Sana d00eef311670a58deb2c323fe072738fcb945600, derived from the official MiniMax-H3 reproducible request"},
    "seed_plan": {"seeds": [0], "repetitions": 10},
    "conditioning_assets": []
  },
  "production": {"is_long": false, "generation_mode": "native_short_clip", "chunk_count": 1, "assembly_method": "none"},
  "track": {
    "id": "practical_disclosed_approx",
    "mechanisms": ["sol_attn_r8_sparse_opt_in", "5_step", "diagnostic_qkv_materialization"],
    "disclosure": "Sparse-attention practical opt-in lane. This record is not BF16 fidelity and not a long-video result."
  },
  "deployment": {"scope": "single_a6000", "gpu_model": "NVIDIA RTX A6000", "gpu_count_visible": 1, "gpu_count_used": 1, "physical_gpu_uuids": ["GPU-5a6b7f13-4a03-c3c5-bb17-ea86b46d8aed"]},
  "timing": {
    "boundary_id": "local_http_request_to_download_complete",
    "cold_e2e": {"status": "not_available_historical_evidence", "seconds": null, "n": 0, "reason": "Canonical cold process/load/validation boundary was not measured."},
    "warm_e2e": {"status": "measured", "seconds": 159.034468, "n": 10, "mean_seconds": 159.3656558, "sample_std_seconds": 0.8083308419242436, "cv_percent": 0.5072177175606011, "min_seconds": 158.57639, "max_seconds": 160.731246},
    "components": {
      "text_conditioning": {"status": "not_available_historical_evidence", "seconds": null, "n": 0, "reason": "Not instrumented.", "timing_basis": "not_available", "additive_to_e2e": true},
      "denoise": {"status": "not_available_historical_evidence", "seconds": null, "n": 0, "reason": "Not separately timed in formal evidence.", "timing_basis": "not_available", "additive_to_e2e": true},
      "attention": {"status": "not_available_historical_evidence", "seconds": null, "n": 0, "reason": "Sparse call counts and materialization bytes exist, but attention seconds were not separately timed.", "timing_basis": "not_available", "additive_to_e2e": false, "parent": "denoise"},
      "video_vae": {"status": "not_available_historical_evidence", "seconds": null, "n": 0, "reason": "Not instrumented.", "timing_basis": "not_available", "additive_to_e2e": true},
      "audio_vae": {"status": "not_available_historical_evidence", "seconds": null, "n": 0, "reason": "Not instrumented.", "timing_basis": "not_available", "additive_to_e2e": true},
      "encoding_mux": {"status": "not_available_historical_evidence", "seconds": null, "n": 0, "reason": "Not instrumented.", "timing_basis": "not_available", "additive_to_e2e": true},
      "io": {"status": "not_available_historical_evidence", "seconds": null, "n": 0, "reason": "Not instrumented.", "timing_basis": "not_available", "additive_to_e2e": true}
    },
    "additive_component_order": ["text_conditioning", "denoise", "video_vae", "audio_vae", "encoding_mux", "io"],
    "seconds_per_generated_second": {"status": "measured", "seconds": 30.780864774193546, "n": 10}
  },
  "resources": {
    "peak_gpu_memory_mib": {"status": "measured", "value": 27354.0, "unit": "MiB"},
    "peak_host_memory_gib": {"status": "not_available_historical_evidence", "value": null, "unit": "GiB", "reason": "Formal summary did not retain host-memory peak."},
    "peak_power_w": {"status": "measured", "value": 301.67, "unit": "W"},
    "failures": {"status": "measured", "value": 0, "unit": "count"}
  },
  "output_av": {
    "status": "complete", "final_accounting_complete": true,
    "video": {"present": true, "full_decode": true, "width": 1344, "height": 768, "fps": 24, "frames": 124},
    "audio": {"present": true, "full_decode": true, "sample_rate_hz": 32000, "channels": 2, "decoded_samples_per_channel": 166912, "effective_samples_per_channel": null, "encoder_priming_samples": null, "end_padding_samples": null}
  },
  "quality": {
    "objective": {
      "subject_identity_consistency": {"status": "not_available_historical_evidence", "value": null, "unit": "score", "reason": "Not measured."},
      "background_consistency": {"status": "not_available_historical_evidence", "value": null, "unit": "score", "reason": "Not measured."},
      "camera_consistency": {"status": "not_available_historical_evidence", "value": null, "unit": "score", "reason": "Not measured."},
      "motion": {"status": "not_available_historical_evidence", "value": null, "unit": "score", "reason": "Not measured."},
      "repetition": {"status": "not_available_historical_evidence", "value": null, "unit": "fraction", "reason": "Not measured."},
      "freezing": {"status": "not_available_historical_evidence", "value": null, "unit": "fraction", "reason": "Structural AV only."},
      "visual_seams": {"status": "not_applicable_single_clip", "value": null, "unit": "ratio", "reason": "One native short clip has no assembly seam."},
      "loudness": {"status": "not_available_historical_evidence", "value": null, "unit": "LUFS", "reason": "Not measured."},
      "silence": {"status": "not_available_historical_evidence", "value": null, "unit": "fraction", "reason": "Structural AV only."},
      "audio_continuity": {"status": "not_applicable_single_clip", "value": null, "unit": "ratio", "reason": "One native short clip has no assembly seam."},
      "av_sync_proxy": {"status": "not_available_historical_evidence", "value": null, "unit": "ms", "reason": "No human or semantic AV-sync certification."}
    },
    "human_gate": {"status": "not_performed_no_semantic_claim", "scope": "Formal acceptance used structural AV and automatic quality proxies only."}
  },
  "promotion": {"level": "formal_n_ge_10", "sample_count": 10, "quality_threshold_id": "sol-r8-structural-av-resource-proxy-v1"},
  "comparisons": [
    {
      "comparison_id": "sol-attn-r8-vs-dense-formal-n10",
      "metric": "http_time_total_seconds",
      "result_kind": "median_time_improvement_percent",
      "value": 15.203295894081867,
      "sample_count": 10,
      "principal_variable": "sol_attn_r8_sparse_opt_in",
      "candidate": {
        "track": "practical_disclosed_approx",
        "workload_fingerprint": "e5c613e9f6bfa57daea3a7c34fab9ebe23653fed39e7226655e71aa15645d885",
        "deployment_scope": "single_a6000",
        "physical_gpu_uuid": "GPU-5a6b7f13-4a03-c3c5-bb17-ea86b46d8aed",
        "timing_boundary_id": "local_http_request_to_download_complete",
        "quality_threshold_id": "sol-r8-structural-av-resource-proxy-v1",
        "generation_mode": "native_short_clip"
      },
      "denominator": {
        "track": "practical_disclosed_approx",
        "workload_fingerprint": "e5c613e9f6bfa57daea3a7c34fab9ebe23653fed39e7226655e71aa15645d885",
        "deployment_scope": "single_a6000",
        "physical_gpu_uuid": "GPU-5a6b7f13-4a03-c3c5-bb17-ea86b46d8aed",
        "timing_boundary_id": "local_http_request_to_download_complete",
        "quality_threshold_id": "sol-r8-structural-av-resource-proxy-v1",
        "generation_mode": "native_short_clip"
      }
    }
  ],
  "claim_boundary": "Median HTTP-time improvement 15.203295894% only in the formal matched same-GPU 5-step opt-in lane; not BF16 fidelity, not long video, not release approval, and not semantic or human quality certification."
}
